127,Radhuni Indian Restaurant,"Calle Principe Carlos, 21",90,4.6,4.644,91.1,3.3,5.6,5,7,73,9,3,3,2,80,81,17,27,6,4,3,11,38,6,0,0,9,88.9,90.0,18.9,30.0,6.7,4.4,3.3,12.2,42.2,6.7,0.0,0.0,10.0,76,74,16,22,5,4,3,8,35,4,0,0,7,3,4,0,3,1,0,0,2,3,2,0,0,1,4.75,4.68,4.65,4.26,3.83,4.75,5.0,4.18,4.61,3.83,,,4.33,True,True,True,True,False,False,False,True,True,False,False,False,False,True,False,True,False,False,False,True,True,True,False,False,"fuimos con ninos asi que un poco dificil, pero esto es problema nuestro, aunque tampoco nos | mida llego muy rapida y muy bien presentada. para beber cerveza cobra, aunque tambien tienen king fisher y espanolas. 100% recomen",,"muy bueno.

lo recomiendo al 100%.

estuvimos en terraza. | agradables. el sitio esta muy limpio. y tiene una terraza amplia donde comes con buena separacion de las otras mesas. un sitio par",,,,"e es que nos sentimos defraudados con la supuesta tarta de 3 chocolates ya que se lo dijimos que eso no era nada mas que un bizcoc | rico y el pollo tikka tambien merece la pena.
los postres no, pedimos una tarta tres chocolates, totalmente industrial y nada rica","una comida mas que aceptable en cuanto a relacion calidad precio (nos gusto especialmente el pollo tikka massala), no recomendaria | n por parte de todo el equipo.
comida excelente y calidad precio buena.
recomendable 100%.","tentos. era el cumple de mi amiga, nos han puesto cumpleanos feliz y una tarta con velas. lo mejor | da uno de los mejores sitios de madrid. todos los cumpleanos de mis amigos lo celebramos ahi por que la atencion es espectacular.",,,Algunos clientes percibieron el establecimiento como común y,"La comida es auténtica y variada, ofreciendo una","arroz(8), curry(5), tarta(4), cordero(4), pollo tandoori(3)","arroz(8), curry(5), tarta(4), cordero(4), pollo tandoori(3), gambas(2), korma(2), pan naan(2), tikka masala(2), bizcocho(1), brownie(1), samosa(1), pimientos(1), pasta(1), helado(1)",,"comida, buena, servicio, atención, excelente",india
128,Coque,"Calle del Marqués del Riscal, 11",90,4.6,4.1,70.0,8.9,21.1,19,22,57,6,8,17,2,53,65,42,22,17,1,2,8,27,4,2,0,34,58.9,72.2,46.7,24.4,18.9,1.1,2.2,8.9,30.0,4.4,2.2,0.0,37.8,37,44,32,11,7,1,0,6,16,2,2,0,23,12,15,7,6,8,0,1,1,9,2,0,0,8,4.15,4.03,4.24,3.68,3.24,5.0,2.5,4.25,3.78,3.5,4.5,,4.0,True,True,True,True,True,False,False,False,True,False,False,False,True,True,False,False,False,False,False,True,False,True,True,False,"detalles delicados despiertan y transportan a su nino interior a un final perfecto de una experiencia gastronomica. toda la noche | eras una “experiencia” que exceda el mero comer y beber que son placeres de esta vida. creemos que lo consiguen, asi que solo por",,,,,,"todo genial. 

ligeramente menos espectacular: el helado de esparragos, la friandise de malvaviscos, y -curiosamente- el vientre d | on lemon grass y fruta acida. 

🍨 el final dulce: postres con historia y poesia

los postres fueron tan brillantes como el resto:",,". desde el momento de la llegada, la secuencia de eventos se siente profundamente experiencial. los huespedes son calidamente reci | endo ir y por fin encontramos el momento para una celebracion especial. como siempre se ha dicho “lo bueno hay que pagarlo” y real","y bien hecho. y  yo destacaria que tienen un menu vegetariano exquisito para aquellas personas que no queremos comer carne ni pesc | recio. me parece muy bien la idea de tener opcion vegetariana. yo no lo soy pero si personas cercanas, y asi pueden disfrutar de u",,Los comensales esperaban una experiencia culinaria,Los clientes destacan una experiencia gastronómica absolutamente inolvidable y especial,"ramen(8), cochinillo(6), presa(6), lubina(4), helado(3)","ramen(8), cochinillo(6), presa(6), lubina(4), helado(3), bonito(3), salmon(3), miso(2), foie(2), angulas(2), manitas(2), jamón ibérico(2), ostras(1), rabo(1), atún(1)",,"experiencia, comida, restaurante, menú, servicio",fusion
129,Cervecería La Mayor,"Calle Mayor, 77",90,4.6,4.567,92.2,1.1,6.7,6,14,68,15,1,2,4,51,51,38,21,6,2,1,8,23,4,0,0,9,56.7,56.7,42.2,23.3,6.7,2.2,1.1,8.9,25.6,4.4,0.0,0.0,10.0,46,47,37,20,6,2,1,7,22,4,0,0,8,4,3,1,0,0,0,0,0,0,0,0,0,0,4.51,4.59,4.74,4.76,4.83,5.0,5.0,4.5,4.91,4.5,,,4.67,True,True,True,True,False,False,False,False,True,False,False,False,False,True,True,False,False,False,False,False,True,False,False,False,"ularmente sabrosa, especialmente el arroz. 

para beber, habiamos sacado cerveza espanola, rioja y numerosas copas de sangria. 

t | ica de espana). sin embargo, ese es el lugar para beber cervezas increibles a un precio justo con algunos aperitivos locales inter","rable.
probamos una tabla de embutidos y el super perro, cantidad generosa y buenos precios para la zona",,,,,,"e es el lugar para beber cervezas increibles a un precio justo con algunos aperitivos locales interesantes. | y unas patatas para picar. buen ambiente.
buenas relacion calidad/precio.
repetiremos",,,,La experiencia general con el servicio fue,Los clientes destacan la gran,"paella mixta(5), jamón(3), sangría(3), presa(3), arroz(2)","paella mixta(5), jamón(3), sangría(3), presa(3), arroz(2), tostas(2), pimientos(1), calamares(1), mejillones(1), croquetas(1), tequeños(1), rabo(1), lomo(1), cecina(1), callos(1)",,"cervezas, cerveza, lugar, sitio, buen",
130,StreetXO,"Calle de Serrano, 47",90,4.3,3.944,72.2,5.6,22.2,20,26,46,19,5,14,6,45,76,35,16,38,21,2,6,29,17,1,7,17,50.0,84.4,38.9,17.8,42.2,23.3,2.2,6.7,32.2,18.9,1.1,7.8,18.9,34,58,27,11,23,14,1,5,19,9,1,3,14,10,13,6,4,14,5,1,1,7,6,0,4,3,3.93,4.11,4.11,3.56,3.42,3.62,2.5,3.83,3.72,3.29,4.0,3.14,4.24,True,True,True,True,True,True,False,False,True,True,False,False,True,True,False,True,True,True,False,True,False,False,False,True,", en ningun momento nos preguntaron que queriamos beber. tampoco nos dieron menu, se lo tuve que pedir a los comensales a mi derec | erez con cabeza de gamba con el que literalmente “bebes” un plato de alta cocina.
ya en la barra, nos fuimos a los platos que esta",,"o estaba abierto el bar. tomamos una bebida en la terraza (tambien pedimos agua, pero nunca llego). terminamos nuestras bebidas y | o, que los que estaban entrando iban a la zona de terraza, y que el orden se estaba respetando. media hora despues, a las 22.30 de",mida callejera latina servida en un mostrador con vistas a una cocina preparatoria fue la experiencia gastronomica mas creativa y,"un ambiente diferencial con una experiencia en vivo. los platos son indescriptibles, cada uno se vuelve un disfrute indescri | te para una buena imagen del local, como si de un concierto se tratara.",,"iva) y el brioche dulce de la pedroche, que es un postre de otro planeta.
y los cocteles… una fantasia. sabores intensos, original | nen les funciona, y los precios, muy elevados, un postre 14 -16 euros o una cerveza 5,5 euros, se aprovechan de que siempre lo tie",,,,"pero bueno.

el problema es que las adaptaciones sin gluten tampoco eran las mejores y encima de todo, se han equivocado!!

mi ni",A pesar de las expectativas generadas por buenas,Ofrece una experiencia culinaria que refleja el lado más aud,"ramen(7), croquetas(7), bogavante(4), sashimi(3), curry(2)","ramen(7), croquetas(7), bogavante(4), sashimi(3), curry(2), pulpo(2), lasaña koreana(2), cocido(1), atún(1), tiradito(1), cheesecake(1), tacos(1), langosta(1), mejillones(1), soufflé(1)",,"experiencia, comida, sabores, platos, ambiente",fusion
131,La Castela,"Calle Doctor Castelo, 22",90,4.4,3.678,64.4,4.4,31.1,28,20,45,13,4,14,14,62,71,28,25,18,4,0,8,22,4,1,0,9,68.9,78.9,31.1,27.8,20.0,4.4,0.0,8.9,24.4,4.4,1.1,0.0,10.0,41,53,19,18,8,1,0,6,14,2,1,0,6,18,14,8,7,10,3,0,1,6,2,0,0,2,3.79,4.1,3.75,3.8,2.83,2.25,,4.12,3.55,2.75,5.0,,3.89,True,True,True,True,True,False,False,False,True,False,False,False,False,True,False,False,False,False,False,True,True,True,False,False,"y poco profesional. cuando pedimos una silla para ninos, en lugar de ayudarnos, hicieron bromas, lo que nos hizo sentir incomodos | ejas de afeitar, dos tipos diferentes de pescado, pequenos camarones fritos, las mas increibles alcachofas a la parrilla en rodaja",,,,,,"po en fin sin tonterias todo mediterraneo 👌 y los postres la tarta de queso espectacular ademas puedes pedir media racion si quier | a, ensaladilla rusa, y boletus con huevo y jamon. postres y cafe. el trato del camarero estupendo y rapidez en servir a pesar de e","araculya tambien espectacular.
servicio muy bueno
calidad precio muy bueno | buenas calidad a precio razonable","ocina, buen servicio.
algo ruidoso 
celebramos un cumpleanos y alrededor se celebraban tres mas | fui de para celebrar la comida de empresa, una amplia carta y de buenas materias primas, es un acierto !",,,Los comensales destacan la excelente calidad,Los clientes expresan frustración por la falta de transparencia,"pulpo(8), arroz(7), croqueta(6), ensaladilla(4), presa(4)","pulpo(8), arroz(7), croqueta(6), ensaladilla(4), presa(4), rabo(4), tarta(3), merluza(3), almejas(3), anchoas(3), bonito(3), solomillo(2), chipirones(2), callos(2), calamares(2)",,"comida, servicio, calidad, restaurante, madrid",
132,Corral de la Moreria,"Calle Morería, 17",90,4.4,3.978,67.8,8.9,23.3,21,14,54,7,8,15,6,54,57,18,16,9,2,0,6,31,5,1,13,14,60.0,63.3,20.0,17.8,10.0,2.2,0.0,6.7,34.4,5.6,1.1,14.4,15.6,43,38,12,7,4,1,0,6,19,3,0,7,11,9,14,5,9,4,1,0,0,10,2,0,4,3,4.31,3.95,3.89,3.0,2.89,3.5,,4.67,3.77,3.6,3.0,3.54,4.14,True,True,True,True,False,False,False,False,True,False,False,True,True,True,False,False,False,True,False,True,False,True,False,False,"algo sin mucho interes, diria que un postre casi infantil. la torrija por ejemplo es un postre contundente y muy generoso. en fin | ...nos aconsejo de maravilla sobre lo que comer y beber. pero sobre todo fue muy amable y educado.
sin ninguna duda repetiremos.",,,,ulo para que pueda terminar su comida antes de la actuacion. vimos a otras personas llegar mas tarde y estaban comiendo mientras e | y buena noche la que pase en este restaurante una actuacion espectacular y una muy buena atencion del camarero oscar muy atento y,,"sin embargo, la tostada francesa caramelizada con helado de platano de postre fue absolutamente maravillosa | ena (al parecer un chef michelin) , especialmente postres. recomienda la sopa de papa y el postre de tostadas francesas.",,"una noche inolvidable!! 
el mejor lugar para una celebracion diferente!!
el espectaculo magnifico, todos los componentes transmit | l de la moreria! gracias por hacer inolvidable el cumpleanos de mi esposa! todo fue 10 / 10 : el servicio fue excepcional, la comi",,,Algunos clientes consideran que la oferta gastronómica,Es un lugar que cumple con las expectativas de quienes buscan,"ramen(6), cordero(5), bonito(4), salmón(3), arroz(2)","ramen(6), cordero(5), bonito(4), salmón(3), arroz(2), helado(1), merluza(1), lubina(1), salmorejo(1), risotto(1), chipirones(1)",,"espectáculo, comida, cena, flamenco, camarero",
133,La Hummuseria,"Calle Hernán Cortés, 4",90,4.5,4.367,85.6,7.8,6.7,6,24,55,22,7,3,3,57,80,34,28,13,2,0,5,30,4,2,0,17,63.3,88.9,37.8,31.1,14.4,2.2,0.0,5.6,33.3,4.4,2.2,0.0,18.9,50,69,30,24,12,2,0,4,30,4,2,0,15,3,5,1,2,0,0,0,0,0,0,0,0,0,4.44,4.39,4.38,4.18,4.62,4.0,,4.4,4.77,4.75,4.5,,4.53,True,True,True,True,True,False,False,False,True,False,False,False,True,True,True,False,True,False,False,True,False,False,True,False,"s del vino: 
habia un vino en la lista que queria beber particularmente, el clos lojen (hecho de la uva bobal) , un vino que bebo | la comida de mi bobe y su mesa llena de platitos pequenos. que emocion, gracias por ese viaje.
el humus es delicioso, hace mucho",ra cuatro y cuando preguntamos si podiamos llevar perro nos dijeron que por supuesto. la atencion ha sido estupenda desde el prime,,"nera trabajando tranquilamente en su estacion con vistas al comedor. el personal es amable y habil, y el comedor de dos niveles co | e y 100% recomendable. tambien probamos el coctel rooftop party tel-aviv que no nos gusto nada.

el trato por parte del personal e",,,"rmente buena... tambien el dorado de coliflor. el postre de kataifi y pistacho se ha convertido en uno de los favoritos de mi mari | amos terminar la cena sin el bocadillo kadaif con helado. 
todo un sueno, y andrea fue muy dulce y servicial con sus recomendacion",,,"drid de autentica e innovadora comida vegetariana/vegana; sin embargo, la hummuseria podria convertirse en nuestra nueva favorita. | ¡espectacular! un restaurante sin carne, comimos 3 platos diferentes, no podemos decir cual fue el mejor! 
har",,El establecimiento es elogiado por su delici,"El restaurante destaca por su auténtica propuesta, alejada de mod","arroz(4), bonito(4), ramen(4), helado(3), coliflor dorada(2)","arroz(4), bonito(4), ramen(4), helado(3), coliflor dorada(2), hummus shakshuka(2), cocido(1), berenjenas(1), secreto(1), tarta(1), margarita(1), pasta(1), pimientos(1)",,"comida, hummus, amable, sitio, madrid",arabe
134,El Camoati,Calle Alfonso VI 3 a 20m de la Plaza de la Paja,90,4.5,4.5,88.9,1.1,10.0,9,9,68,12,1,5,4,65,74,39,25,12,4,0,1,27,10,0,0,22,72.2,82.2,43.3,27.8,13.3,4.4,0.0,1.1,30.0,11.1,0.0,0.0,24.4,58,66,37,23,8,4,0,1,25,7,0,0,22,6,7,2,1,3,0,0,0,2,3,0,0,0,4.52,4.49,4.69,4.52,3.67,5.0,,5.0,4.48,3.7,,,4.82,True,True,True,True,True,False,False,False,True,True,False,False,True,False,False,True,False,False,True,True,True,True,True,False,,,"de 10, atencion excepcional y buen amabiente. la terraza un acierto, personal super amable y buenas recomendaciones de carta | radable y segura.  unicamente un poco incomodo la terraza.",,,"creible la experiencia gustativa, el ambiente muy romantico que recuerda a los bistrot franceses. un 10. precio por comensal 30€. | ambiente tranquilo y muy intimo, con un personal agradable. la comida estaba espectacular, volveremos!","elada fuese inmejorable. la carne de primera!! el tiramisu mejor que en italia, gracias! | los dos tartar, los chipirones, el tataki, y los postres recomiendo el helado mousse de maracuya y el volcan de dulce de leche. i","ersona vegetariana y tenia bastante donde elegir.
calidad precio normal. 
me parecio un poco incomodo el cenar en sillon, mejor en | he ido en varias ocasiones y mantienen una gran calidad precio y el trato es de 10. la entrana esta espectacular y las empanadas","vinimos a celebrar un cumpleanos (fiesta de 6 ). si bien la carne era muy buena y el ambiente estaba b | ima y los camareros super amables, hicieron de un cumpleanos un dia super guay. cada plato que pruebas, su sabor te invade y te tr","diversidad de platos, por ejemplo iba una persona vegetariana y tenia bastante donde elegir.
calidad precio normal. 
me parecio un",,Los clientes generalmente elogiaron la excelente comida,Los clientes experimentaron gran incomodidad debido a mesas pequeñas y,"entraña(10), empanadas(6), pasta(4), chorizo(4), tiramisú(3)","entraña(10), empanadas(6), pasta(4), chorizo(4), tiramisú(3), atún(3), bonito(3), mousse(3), ramen(3), tarta(2), mollejas(2), empanada criolla(2), salmón(1), chipirones(1), helado(1)",,"comida, buena, carne, atención, sitio",argentina
135,Brunch Club Cafe,"Calle Barco, 15",90,4.6,4.456,88.9,0.0,11.1,10,12,65,15,0,6,4,62,68,26,20,16,3,3,5,35,4,0,0,10,68.9,75.6,28.9,22.2,17.8,3.3,3.3,5.6,38.9,4.4,0.0,0.0,11.1,59,60,26,18,11,3,3,4,32,3,0,0,8,3,8,0,2,5,0,0,1,3,1,0,0,2,4.63,4.43,4.77,4.45,3.81,5.0,4.67,4.2,4.63,4.25,,,4.2,True,True,True,True,True,False,False,False,True,False,False,False,True,True,False,False,False,False,False,False,True,False,True,False,"adas , cafe y todo delicioso !! nos gusto a todos ninos y adultos . 

por persona gastamos unos 15 euros .

super recomendado !! | covid 
bueno eramos dos parejas de adultos y una bebe de 11 meses que de inmediato ante la agresion comienza a llorar
finalmente",,,,,,,"mos el menu establecido que es excelente relacion calidad-precio - bebida fria, bebida caliente, yogur, huevos y tostadas con sele | do momento. la comida genial y muy buena relacion calidad-precio. recomendable al 100%! volveremos seguro!!",,"en cafe y personal muy amable. tengo una ensalada vegana para el desayuno y era promedio. el espacio tiene un buen ambiente, pero",,"Los visitantes destacan la excelente comida, con","Es un lugar ideal para reuniones familiares y encuentros especiales, incluso para quienes","salmón(5), bonito(3), callos(1), morcilla(1), cochinillo(1)","salmón(5), bonito(3), callos(1), morcilla(1), cochinillo(1)",,"brunch, comida, servicio, lugar, atención",
136,Alcaravea Gaztambide,"Calle Gaztambide, 56",90,4.5,4.6,93.3,3.3,3.3,3,12,64,20,3,2,1,66,74,28,30,12,0,0,6,21,6,0,0,5,73.3,82.2,31.1,33.3,13.3,0.0,0.0,6.7,23.3,6.7,0.0,0.0,5.6,62,70,26,27,11,0,0,6,19,5,0,0,4,2,2,1,1,1,0,0,0,2,0,0,0,0,4.64,4.66,4.5,4.57,4.25,,,4.83,4.57,4.67,,,4.2,True,True,True,True,True,False,False,False,True,False,False,False,False,False,False,False,False,False,False,True,True,True,False,True,,,,,,,"y abundantes. compartimos varios platos y algunos postres. hemos ido mas de 10 veces y es un lugar que no defrauda. super recomend | menu degustacion (el b) muy rico con 6 platos y postres. el foie, el puerro, el salmorejo y el solomillo lo mas destacado. la cr","da fantastica, gran servicio y muy buena relacion calidad-precio. muy recomendable. famoso por platos de huevo roto en patata frit | daciones y un trato excelente. muy buena relacion calidad precio","ada momento,recomendable para cualquier ocasion y evento. | e.
recomendable totalmente para cualquier tipo de evento.",,"e al gluten y pidio a cocina que me hornearan pan sin gluten sin que yo se lo pidiera. el pan estaba buenisimo. la comida estaba r | s bienvenidos. al pedir una cerveza se sirvio una sin gluten, al decir que se habia confundido la respuesta fue que el sabor era e","La experiencia en el restaurante es consistentemente positiva,",Este restaurante es un favorito,"tarta(11), pulpo(7), bacalao(5), bonito(5), croquetas(4)","tarta(11), pulpo(7), bacalao(5), bonito(5), croquetas(4), foie(3), salmorejo(3), solomillo(3), huevos rotos(3), tortilla trufada(3), jamón(2), cocido(2), ensaladilla(2), tiramisú(1), curry(1)",,"comida, buena, servicio, platos, carta",
137,Ático Restaurante & Terraza,Calle Marques de Valdeiglesias 1 Esquina Gran Via 2,90,4.4,3.8,70.0,2.2,27.8,25,12,47,16,2,12,13,68,69,30,32,15,5,1,7,29,25,20,0,23,75.6,76.7,33.3,35.6,16.7,5.6,1.1,7.8,32.2,27.8,22.2,0.0,25.6,53,49,24,20,5,4,0,2,20,15,16,0,18,13,18,4,11,10,1,1,4,8,10,4,0,5,4.07,3.81,4.17,3.56,2.47,4.2,2.0,2.71,3.86,3.4,4.05,,4.04,True,True,True,True,True,False,False,False,True,True,True,False,True,False,True,True,True,False,False,True,True,True,False,False,,". 
en el corazon de ayvalık. una bonita pareja de mascotas esta dirigiendo el negocio. definitivamente recomendable! | le pedimos agua para nuestro perro 🐕 y nos dijo que no tenia nada para darsela, que ademas su jefe se lo proh","afirman. elegimos sentarnos dentro, pero cenar en terraza una opcion. recomendaria encarecidamente como opcion si busca una experi | teniamos esta noche reserva en la terraza para mi marido y para mi por motivo de mi cumpleanos
lo primero es que t",iciosos platos de calidad. en una planta alta las vistas desde la terraza son maravillosas. si te alojas en el hotel no pienses qu | hay que reconocer que tiene unas vistas increibles. la cupula del edificio metropolis resulta increible vista tan,,,"no abrir otra zona
pedimos ensalada de aguacate, tartar de atun, salmon y una copa de vino blanco para mi marido
nos pusieron sin | asable, pero tampoco para volver, en cuanto a los postres la torrija  caramelizada de brioche en vez de ser de brioche te ponen un",pero no en liga cuerda. servicio excelente. a un precio razonable. | esperaba mas. calidad precio hay mil opciones mejores en madrid. fuimos a cenar a principios d,"terraza para mi marido y para mi por motivo de mi cumpleanos
lo primero es que teniendo reserva en la terraza nos querian poner en | s vistas son bonitas, pero cuando fuimos habia un evento privado y la cocina habia decidido no dar servicio al resto de las mesas.",,,"Los comensales destacan una experiencia excepcional, impuls",Los clientes destacan una,"bacalao(13), tarta(11), buñuelos(9), atún(7), croqueta(7)","ensaladilla(4), langostinos(3), lubina(3), ramen(3), bacalao(13), tarta(11), buñuelos(9), atún(7), croqueta(7), helado(6), merluza(6), jamón(5), bonito(4), gazpacho(4), presa(4), flan(3), foie(3), pulpo(3), arroz meloso(3)",,"comida, servicio, restaurante, excelente, platos",
138,Valdivieso Cocina Con Alma,"Calle Fray Luis de Leon, 7,",90,4.6,4.5,85.6,7.8,6.7,6,9,65,12,7,5,1,58,78,24,22,5,1,2,3,33,10,0,2,8,64.4,86.7,26.7,24.4,5.6,1.1,2.2,3.3,36.7,11.1,0.0,2.2,8.9,48,67,20,18,4,1,2,3,30,6,0,2,7,4,4,1,1,0,0,0,0,1,2,0,0,1,4.45,4.51,4.33,4.45,4.6,5.0,4.5,4.33,4.58,3.9,,5.0,4.38,True,True,True,True,False,False,False,False,True,True,False,False,False,True,True,True,False,True,False,True,True,False,False,False,"da casdualidad - la cercania de una pareja con un nino de meses que no paro de llorar.
para tomar nota y volver. | setas riquisimas , rodrigo un crack , pequenos jamones de cordero y croquetas muy ricas.  recomendable","to el camareo, que nis permitio comer con nuestra mascota dentro del bar para estar mas fresquitos. ¡muchas gracias!.","el local no es muy grande, fuera tiene una terraza agradable. la carta no tiene muchos platos pero todos apetecibles, proba | tenia a mi espalda. recomendable la opcion de la terraza.
ademas de la atencion personalizada, la explicacion de los platos y la",,"conocer valdivieso.
aprovechando que teniamos un concierto en el price, reserve para cenar, a la salida. 
el trato por parte del",,"tos. probamos de entrada el jamon de cordero y un tartar de atun correctos. y luego compartimos un socarrat muy conseguido. acabam | anto, las gildas, las ostras, las alcachofas y el tartar de atun. los platos estan muy bien elaborados, con producto de calidad.
l","relacion calidad precio muy competitivo! edtuvimos muy a gusto, la comida muy rica y bien | lasana de verduras muy escasas), pero la relacion calidad precio es excesiva, tanto en los platos como en los vinos.",,,,Los,"Los clientes suelen destacar experiencias culinarias de alto nivel, consider","tarta(10), rodaballo(8), atún(7), chipirones(6), cordero(6)","tarta(10), rodaballo(8), atún(7), chipirones(6), cordero(6), carabineros(5), rabo(5), ceviche(4), arroz(3), helado(3), morcilla(3), ostras(2), coulant(2), croqueta(2), tiramisú(2)",,"platos, comida, carta, cocina, excelente",
139,Restaurante Sal Negra,"Calle de Mateo Inurria, 33",90,4.5,4.3,84.4,4.4,11.1,10,20,55,21,4,6,4,70,80,32,28,10,8,0,7,29,24,0,1,18,77.8,88.9,35.6,31.1,11.1,8.9,0.0,7.8,32.2,26.7,0.0,1.1,20.0,63,69,25,22,8,8,0,6,25,22,0,1,17,4,7,4,4,2,0,0,1,3,2,0,0,1,4.46,4.39,4.22,4.21,4.2,4.62,,4.57,4.28,4.5,,5.0,4.56,True,True,True,True,True,False,False,False,True,True,False,False,True,True,False,True,False,True,False,True,True,True,True,False,"z que voy y no repetire.
hemos ido 4 adultos y un bebe. de entrada muy bien y amables. nos sentaron en la terraza, lugar agradable | as, bacalao, unos solomillos tiernisimos para los ninos y... ay el postre! delicioso! maravillosa atencion desde que entras por la",,"enisimo. el servicio y el ambiente muy buenos. la terraza tiene muy buena pinta tambien. repetiremos seguro! | de entrada muy bien y amables. nos sentaron en la terraza, lugar agradable y con mucha luz. pedimos entrantes a compartir y un pla",,"tar de un after work con el lujo de tener un dj y musica en directo! 

lugar ideal para cenas de negocios, empresa, familia, parej",,"tanto los diferentes platos que pedimos, como los postres, deliciosa.
el precio muy acorde con la calidad y el servicio.
en resume | las ortiguillas con un penetrante sabor a mar, el tartar de lubina tiene una textura diferente, no parece pescado, el pulpo en su","pero las raciones bastante pequenas. en relacion calidad precio no lo recomendaria. | servicio de 10, trato exquisito y precio razonable para el servicio y calidad que ofrecen, sin duda la proxima vez","comida de celebracion de un grupo de amigos. escogimos un menu de grupo, el numero 2, y es | hasta creaciones innovadoras, cada bocado es una celebracion de la cocina espanola. el ambiente acogedor y el servicio impecable","esafortunado comentario acerca de mi condicion de vegetariano, nada habia en la carta como alternativa. asi que educadamente le pe",,El restaurante ofrece una,Aunque hay alguna experiencia negativa,"tarta(15), pulpo(9), almejas(8), bacalao(7), bonito(7)","solomillo(3), tarta(15), pulpo(9), almejas(8), bacalao(7), bonito(7), presa(7), atún(5), buñuelos(5), croqueta(5), lomo(5), lubina(4), rodaballo(3), ensaladilla rusa(3), arroz(2), tiradito(2)",,"comida, platos, servicio, restaurante, calidad",
140,El Rey De Los Tacos,"Calle De Isabel La Católica, 13",90,4.5,4.344,85.6,0.0,14.4,13,17,63,14,0,7,6,59,70,26,29,18,1,1,7,39,0,0,0,4,65.6,77.8,28.9,32.2,20.0,1.1,1.1,7.8,43.3,0.0,0.0,0.0,4.4,55,62,23,27,12,1,1,6,35,0,0,0,3,4,8,3,2,6,0,0,1,4,0,0,0,1,4.64,4.47,4.38,4.59,3.78,5.0,5.0,4.14,4.49,,,,4.0,True,True,True,True,True,False,False,False,True,False,False,False,False,True,False,False,False,False,False,False,True,False,False,False,"na.recomiendo el taco del rey y la margarita para beber.precios muy competitivos. | erminamos pidiendo algunos extras ya que eran mas pequenos en tamano de lo que se habia anticipado originalmente. 

el servicio fu",,,,,,,"de los mejores mexicanos de madrid con relacion calidad-precio increible! el personal de 10! | comida buenisima y excelente calidad precio. desde luego, la proxima vez que vengamos a madrid repetiremos. a",,,,Los,Su cocina ofrece las especial,"nachos(14), margarita(8), guacamole(8), quesadilla(4), mojito(3)","nachos(14), margarita(8), guacamole(8), quesadilla(4), mojito(3), bonito(3), tacos quesadillas(2), tortilla(1), cochinillo(1)",,"comida, tacos, lugar, amable, buena",mexicana
