id_restaurante,nombre,direccion,n_resenas,valoracion_google,avg_estrellas_modelo,pct_positivo,pct_neutro,pct_negativo,n_resenas_negativas,n_baja_confianza,estrellas_5,estrellas_4,estrellas_3,estrellas_2,estrellas_1,servicio_menciones,comida_menciones,ambiente_menciones,precio_menciones,velocidad_menciones,ruido_menciones,limpieza_menciones,ninos_menciones,mascotas_menciones,terraza_menciones,vistas_menciones,musica_directo_menciones,romantico_menciones,servicio_pct,comida_pct,ambiente_pct,precio_pct,velocidad_pct,ruido_pct,limpieza_pct,ninos_pct,mascotas_pct,terraza_pct,vistas_pct,musica_directo_pct,romantico_pct,servicio_pos,comida_pos,ambiente_pos,precio_pos,velocidad_pos,ruido_pos,limpieza_pos,ninos_pos,mascotas_pos,terraza_pos,vistas_pos,musica_directo_pos,romantico_pos,servicio_neg,comida_neg,ambiente_neg,precio_neg,velocidad_neg,ruido_neg,limpieza_neg,ninos_neg,mascotas_neg,terraza_neg,vistas_neg,musica_directo_neg,romantico_neg,servicio_avg_stars,comida_avg_stars,ambiente_avg_stars,precio_avg_stars,velocidad_avg_stars,ruido_avg_stars,limpieza_avg_stars,ninos_avg_stars,mascotas_avg_stars,terraza_avg_stars,vistas_avg_stars,musica_directo_avg_stars,romantico_avg_stars,servicio_rep,comida_rep,ambiente_rep,precio_rep,velocidad_rep,ruido_rep,limpieza_rep,ninos_rep,mascotas_rep,terraza_rep,vistas_rep,musica_directo_rep,romantico_rep,criterio_ninos,criterio_mascotas,criterio_terraza,criterio_vistas,criterio_musica_directo,criterio_romantico,criterio_buen_postre,criterio_precio_calidad,criterio_grupos_grandes,criterio_vegano_vegetariano,criterio_sin_gluten,criterio_ninos_frases,criterio_mascotas_frases,criterio_terraza_frases,criterio_vistas_frases,criterio_musica_directo_frases,criterio_romantico_frases,criterio_buen_postre_frases,criterio_precio_calidad_frases,criterio_grupos_grandes_frases,criterio_vegano_vegetariano_frases,criterio_sin_gluten_frases,servicio_frases,resenas_destacadas,top5_platos,todos_platos,personal_destacado,terminos_tfidf,cocina_detectada
1,Los Montes de Galicia,"Calle Azcona, 46",90,4.8,4.844,97.8,1.1,1.1,1,16,79,9,1,1,0,82,81,20,4,5,1,0,4,27,3,1,1,23,91.1,90.0,22.2,4.4,5.6,1.1,0.0,4.4,30.0,3.3,1.1,1.1,25.6,80,79,20,3,5,1,0,4,27,2,1,1,23,1,1,0,0,0,0,0,0,0,1,0,0,0,4.83,4.83,4.9,4.0,4.8,5.0,,5.0,5.0,4.0,5.0,5.0,4.83,True,True,True,False,False,False,False,False,True,False,False,False,True,False,False,False,False,False,False,True,False,False,False,False,,,,,,,sta riquisima recomiendo lomo bajo costillas y de postre la torrijas mas buena de espana nos atendio manuel un senor encantador pe | os de bacalao la empandas los chipirones hasta el postre con esa falla y taeta de queso gracias,,,,,Los comensales quedaron encantados con la exquis,La experiencia es siempre perfecta,"pulpo(9), bacalao(8), buñuelos(8), lomo bajo(5), lubina(4)","pulpo(9), bacalao(8), buñuelos(8), lomo bajo(5), lubina(4), croqueta(4), lasaña(4), merluza(4), tarta(4), cecina(3), atún rojo(2), atun(1), callos(1), torrijas(1), navajas(1)",,"comida, manuel, servicio, atención, trato",gallega
2,Kathmandu Tandoori House,"Calle Acuario, 11",90,4.9,4.756,94.4,1.1,4.4,4,15,81,4,1,0,4,55,76,6,15,15,0,2,6,22,1,0,0,0,61.1,84.4,6.7,16.7,16.7,0.0,2.2,6.7,24.4,1.1,0.0,0.0,0.0,54,74,5,14,14,0,2,6,21,1,0,0,0,0,1,0,1,0,0,0,0,1,0,0,0,0,4.91,4.88,4.67,4.67,4.87,,5.0,5.0,4.77,5.0,,,,True,True,False,True,True,False,False,False,True,False,False,False,False,False,False,False,False,False,False,False,True,False,True,False,,,,,,,,gran sabor servicio encantador excelente relacion calidad precio sin duda volveria a este restaurante de nuevo si alguna vez estuv | para la comida indina a precio asequible relacion calidad precio es excelente estamos tan contentos de que encontramos este lugar,,volveremos nos encanto probamos toda la comida en vegetarianos y sale muy bien el personal es amable y el servicio r amable n | on una carta variada y muchas opciones riquisimas vegetarianas recomendable,,Los clientes destacan la excelente calidad y,"Los clientes destacan una calidad excepcional, superando incluso a otros","tikka masala(11), biryani(7), naan queso(7), cordero(6), masala naan(4)","tikka masala(11), biryani(7), naan queso(7), cordero(6), masala naan(4), curry(3), queso arroz(3), korma(2), gambas(1), tandoori(1), lasaña(1), samosa(1)",,"comida, pollo, buena, barajas, servicio",india
3,Grama Lounge,"Calle de la Cruz, 19",90,4.8,4.667,93.3,0.0,6.7,6,16,75,9,0,3,3,69,52,23,6,10,5,2,5,24,5,0,0,10,76.7,57.8,25.6,6.7,11.1,5.6,2.2,5.6,26.7,5.6,0.0,0.0,11.1,64,49,22,6,8,5,2,5,24,5,0,0,8,5,3,1,0,2,0,0,0,0,0,0,0,2,4.62,4.69,4.74,4.83,4.4,5.0,4.5,5.0,4.83,4.8,,,4.2,True,True,True,False,True,False,False,False,True,False,False,False,True,False,False,True,False,False,False,False,False,True,False,True,,,estamos acostumbrado ambiente muy agradable en la terraza interior servicio correcto no se si repetiria pero al menos hay que prob | hablaba ingles linda habitacion trasera ambiente al aire libre y calido tapas y comidas a precios razonables,,,,,,etrasos pero no tanto tiempo habia algun grupo de eventos exclusivo en la parte trasera del restaurante y les tomo mas tiempo de l | nuestra hija organizo su fiesta de cumpleanos de calles en el salon grama el personal era muy servicial y sugirio l,,las arepas sin gluten estaban deliciosas personal amable que hablaba ingles linda habitacio,Los clientes lamentan haber descubierto el establecimiento,Los clientes expresaron una profunda decepción con la calidad de,"arepas(12), tequeños(5), fajitas(2), cachapas(2), sangria(2)","arepas(12), tequeños(5), fajitas(2), cachapas(2), sangria(2), guacamole(1), margarita(1), cochinillo(1), pabellón(1)",,"comida, atención, excelente, junior, gianfranco",venezolana
4,Sakale,"Calle del molino de viento, 4",90,4.8,4.789,95.6,0.0,4.4,4,8,81,5,0,2,2,63,68,17,6,9,10,0,3,24,0,1,0,10,70.0,75.6,18.9,6.7,10.0,11.1,0.0,3.3,26.7,0.0,1.1,0.0,11.1,61,65,17,3,8,10,0,3,23,0,1,0,8,2,3,0,3,1,0,0,0,1,0,0,0,2,4.86,4.78,4.94,3.33,4.56,5.0,,4.67,4.79,,5.0,,4.2,True,True,True,False,False,True,False,False,True,False,False,False,True,False,False,False,False,False,False,False,False,True,True,False,,,,,,,,,vine a celebrar mi cumpleanos con amigas y todo maravilloso la comida deliciosa la compania perfect | hemos ido a celebrar el cumpleanos de mi amigas y ha sido un sitio comodo con buentrato y un ambiente mu,a comida estaba deliciosa nos pedimos sushi y soy vegetariana y no hubo ningun problema me prepararon sushi de zanahoria queso cre,,Los clientes destacan consistent,"Los clientes elogian la fantástica experiencia culinaria, destac","sushi(28), migas(4), fajitas(2), margarita(2), arroz frito(2)","sushi(28), migas(4), fajitas(2), margarita(2), arroz frito(2), nachos(1), atún(1), salmón(1), mojito(1), sangría(1)",,"comida, sushi, alejandro, atención, buena",japonesa
5,Zenith Caffè - Valverde,"Calle Valverde, 28",93,4.8,4.505,89.2,1.1,9.7,9,14,71,12,1,4,5,70,76,13,10,21,4,4,3,19,3,1,0,8,75.3,81.7,14.0,10.8,22.6,4.3,4.3,3.2,20.4,3.2,1.1,0.0,8.6,69,73,13,8,16,2,4,3,17,2,1,0,7,0,2,0,2,4,2,0,0,2,0,0,0,1,4.8,4.75,4.77,4.2,4.24,3.25,4.75,4.33,4.58,4.0,5.0,,4.25,True,True,True,True,True,False,False,False,True,False,False,False,False,False,False,False,False,False,False,False,False,False,True,True,,,,,,,,,,atencion espectacular y buena comida los pancakes veganos y el zumo detox lo mejor me atendio lorenzo y fue muy gracioso y simpati | encontre brunch con opcion vegetariana y sin gluten todo super rico la atencion de jesus excelente,encontre brunch con opcion vegetariana y sin gluten todo super rico la atencion de jesus excelente | n lugar maravilloso muy buena comida con opciones gluten free deliciosas bebidas con opciones sin alcohol y gran atencion de jesus,El servicio es generalmente,"Los clientes elogian su ambiente luminoso, moderno y con una decoración cuid","ramen(3), salmón(1), quesadilla(1)","ramen(3), salmón(1), quesadilla(1)",,"comida, lugar, servicio, atención, buena",
6,Tabernas El Sur,"Calle Torrecillas del Leal, 12",93,4.7,4.688,94.6,2.2,3.2,3,16,75,13,2,0,3,65,67,28,9,8,8,0,1,4,1,0,0,9,69.9,72.0,30.1,9.7,8.6,8.6,0.0,1.1,4.3,1.1,0.0,0.0,9.7,64,66,28,9,8,8,0,1,4,1,0,0,9,0,0,0,0,0,0,0,0,0,0,0,0,0,4.83,4.81,4.71,4.56,4.88,5.0,,5.0,5.0,5.0,,,4.89,True,True,True,False,False,False,False,False,False,False,False,False,False,False,False,False,False,False,False,False,True,False,False,False,,,,,,,,e buena y el local es acogedor muy buena relacion calidad precio sitio al que hay que ir si estas en el centro de madrid y quieres | ugar y no dejaria de venir la comida es en cuanto calidad precio como me gusta y adicional el mesero johan es super amable y profe,,,,Los clientes destacan la excelente y vari,"Este establecimiento destaca por su ambiente típicamente español, pequeño","paella(10), croqueta(9), lomo bajo(4), pulpo(3), risotto(3)","paella(10), croqueta(9), lomo bajo(4), pulpo(3), risotto(3), huevos rotos(3), sangría(3), solomillo(3), cheesecake(2), mojito(2), gambas(2), ordenamos secreto(2), jamón ibérico(2), empanadas(2), tortilla(1)",,"comida, excelente, servicio, jhoan, ambiente",
7,Taberna El Sur De Huertas,"Calle de las huertas, 24",93,4.8,4.591,91.4,1.1,7.5,7,16,76,9,1,1,6,67,71,23,15,11,5,1,4,21,0,0,0,2,72.0,76.3,24.7,16.1,11.8,5.4,1.1,4.3,22.6,0.0,0.0,0.0,2.2,65,67,23,15,10,5,1,4,21,0,0,0,2,2,3,0,0,1,0,0,0,0,0,0,0,0,4.79,4.7,4.87,4.8,4.36,4.8,5.0,4.5,5.0,,,,5.0,True,True,True,True,True,False,False,False,True,False,False,False,False,False,False,False,False,False,False,True,False,False,False,True,,,,,,,excelente atencion las tartas muy ricas la comida excelente repetiremos cuando volvamos a madrid exelen | buen servicio la tortilla espanola fenomenal y la tarta de chocolate tambien muy buenos los huevos rotos gambones a la plancha y l,,,,fuimos con mi hija celiaca comimos delicioso fueron muy cuidadosos con el tema del gluten todo estu,Los comensales destacan la excelente calidad de la,La comida española tradicional,"paella(12), pulpo(6), risotto(5), tarta(5), bacalao(3)","paella(12), pulpo(6), risotto(5), tarta(5), bacalao(3), gambas(3), calamares(2), croquetas(2), lomo(2), huevos rotos(2), empanadas argentinas(2), patatas bravas(2), arroz(1), sangría(1), chipirones(1)",,"comida, buena, excelente, atención, camareros",
8,Taberna Más Al Sur,"Calle Santa Isabel, 35",93,4.7,4.656,92.5,1.1,6.5,6,10,80,6,1,0,6,70,76,24,15,8,3,1,6,19,4,0,0,17,75.3,81.7,25.8,16.1,8.6,3.2,1.1,6.5,20.4,4.3,0.0,0.0,18.3,68,72,23,15,7,3,1,6,18,3,0,0,17,2,3,1,0,1,0,0,0,1,1,0,0,0,4.83,4.74,4.75,4.87,4.25,5.0,5.0,4.83,4.79,3.5,,,4.94,True,True,True,True,False,False,False,False,True,False,False,False,True,True,False,False,False,False,False,True,True,False,True,False,increible teniamos la paella de mariscos calamar bebe a la parrilla pastel de chocolate y vinos tintos el servicio maravilloso y | on huevo y patatas fritas y ensalada de calamares bebe puedo recomendar los dos,,,,,,per tuvieron el detalle de ponerme una vela en la tarta en mi noche especial gracias | ra y tuvimos una paella increible y empanadas los postres tambien eran fantasticos recomiendo,ente servicio rapido eficiente y amable menu a un precio razonable comida de alta calidad puede hacer enfoque para solicitudes fue | muy rica la comida y excelente la atencion calidad precio muy bien si te pasas por madrid vistalos merece la pena buena ubi,,muy buena comida pedi la hamburguesa vegetariana que estaba muy deliciosa muy amable camarero que nos dio una pequena | encion y comida exquisita incluso con opcion para veganos lo cual se agradece cuando alguno delgrupo lo es el precio es muy bueno,,Los clientes destacan la excelente comida elaborada con ingredientes,Su excelente ubicación lo,"paella(15), croquetas(6), sangria(6), risotto(6), jamón(3)","paella(15), croquetas(6), sangria(6), risotto(6), jamón(3), bonito(3), tarta(2), empanadas(2), chipirones(2), huevos rotos(2), bacalao(1), pimientos(1), calamares(1), vermut(1), gambas(1)",,"comida, excelente, amable, servicio, buena",
9,Inclán Brutal Bar,"Calle de Álvarez Gato, 4",90,4.7,4.622,90.0,3.3,6.7,6,18,73,8,3,4,2,67,57,29,9,3,2,0,2,31,1,1,0,12,74.4,63.3,32.2,10.0,3.3,2.2,0.0,2.2,34.4,1.1,1.1,0.0,13.3,62,50,25,5,2,2,0,2,28,1,0,0,11,4,4,2,4,1,0,0,0,3,0,0,0,1,4.69,4.54,4.48,3.56,3.67,4.5,,5.0,4.58,5.0,3.0,,4.58,True,True,True,False,False,False,False,False,True,False,False,False,True,True,False,False,False,False,False,False,False,False,False,False,desembre sena maiores una nina puedo quiero celebrar el ano nuevo alli si las o estan libres queremos pasa | es elegante animado y muy divertido perfecto para beber con amigos los cocteles son creativos sabrosos y siempre bellamente presen,,,,,,,,,,,Los clientes destacan la espectacular decoración del,"El local destaca por su original y excelente decoración, creando un ambiente","zamburiñas(5), croquetas(5), risotto(4), bonito(3), arroz(2)","zamburiñas(5), croquetas(5), risotto(4), bonito(3), arroz(2), paella(2), pasta(1), sangria(1), negroni(1), lasaña(1), jamón(1), pulpo(1)",,"comida, servicio, experiencia, lugar, excelente",
10,SteakBurger Gran Vía 16,"Calle Gran Vía, 16",96,4.7,3.479,60.4,4.2,35.4,34,16,47,11,4,9,25,66,60,18,15,22,2,4,5,22,5,0,0,9,68.8,62.5,18.8,15.6,22.9,2.1,4.2,5.2,22.9,5.2,0.0,0.0,9.4,47,42,15,12,12,2,2,3,13,2,0,0,5,18,14,2,3,9,0,2,2,9,3,0,0,3,3.85,3.9,4.33,4.2,3.27,4.0,2.75,3.4,3.5,2.8,,,3.67,True,True,True,True,True,False,False,False,True,False,False,False,False,False,True,False,False,False,False,True,True,False,False,True,,de esperar mesa al senor encargado segun dijo el perro para las otras mesas podia ser una molestia nos encajonado en una esquina,,,,,excelente atencion comida exquisita postres magnificos oo recomendaria una experiencia inolvidable y perfecta | y era muy bueno de postre partimos una rodaja de tarta de queso y no decepciono el servicio era bastante bueno,el sitio genial la comida muy buena calidad precio recomendado nuestros camareros denis y melvin geniales nos aconse | para cenar en familia muy buena calidad de comida precio razonable excelente atencion calido el personal y rapido el servicio,,,vamos en hora punta nos sirvieron la hamburguesa sin gluten que nos habian hecho cambiar previamente porque la salsa gotxa tenia,El personal es generalmente elogiado por,Los clientes destacan la excelente,"nachos(6), filete(3), guacamole(2), lomo(1), tarta(1)","nachos(6), filete(3), guacamole(2), lomo(1), tarta(1), quesadilla(1), costillar(1), tortilla(1), croquetas(1)",,"comida, servicio, buena, excelente, hamburguesas",americana
11,Pastamore Alcalá,"Calle de Alcalá, 191",90,4.9,4.933,100.0,0.0,0.0,0,7,84,6,0,0,0,74,71,18,35,8,3,1,6,22,2,0,0,14,82.2,78.9,20.0,38.9,8.9,3.3,1.1,6.7,24.4,2.2,0.0,0.0,15.6,74,71,18,35,8,3,1,6,22,2,0,0,14,0,0,0,0,0,0,0,0,0,0,0,0,0,4.96,4.94,4.89,4.94,4.88,4.67,5.0,4.83,4.86,5.0,,,4.93,True,True,True,True,False,False,False,False,True,False,False,False,True,False,False,False,False,False,True,True,True,True,False,False,,,,,,un italiano de verdad en madrid ambiente intimo pasta artesanal deliciosa las pizzas buenisimas y el postre memorable ese | encantadora un buen servicio y el lugar acogedor romantico bastante intimo con muy buena musica la comida divina cada plato con s,especialmente babi la pizza de pulpo muy buena el postre espectacular los helados y el tiramisu muy buenos | ta artesanal deliciosa las pizzas buenisimas y el postre memorable ese tiramisu se queda en el top de mi vida el servicio excepcio,encia y trato de diana la comida muy rica y buena calidad precio muchas gracias | rato excelente sitio acogedor y comida fantastica calidad precio increible me atendio patricia que es la encargada y la atencion d,hermoso evento de celebracion de un cumpleanos familiar fantastica comida y atencion encantadora d | en el servicio y muy atentos con nosotros era el cumpleanos de nuestra amiga y sin decirles nada nos sorprendieron con velas en e,,,Los clientes destacan la excelente calidad de,La atención al cliente es,"tiramisú(11), pasta(6), pizza carbonara(4), risotto(2), lasaña(1)","tiramisú(11), pasta(6), pizza carbonara(4), risotto(2), lasaña(1), pulpo(1), mojito(1), margarita(1), tequeños(1), brownie(1)",,"comida, diana, atención, excelente, servicio",italiana
12,El Sur de Moratín,"Calle Moratín, 19",93,4.8,4.667,92.5,3.2,4.3,4,13,77,9,3,0,4,68,61,29,16,5,4,0,4,19,2,0,0,9,73.1,65.6,31.2,17.2,5.4,4.3,0.0,4.3,20.4,2.2,0.0,0.0,9.7,66,58,29,16,4,4,0,4,19,2,0,0,8,0,1,0,0,0,0,0,0,0,0,0,0,0,4.81,4.77,4.86,4.94,4.4,4.75,,5.0,4.95,5.0,,,4.67,True,True,True,True,False,False,False,False,True,False,False,False,False,True,True,False,False,False,False,True,True,False,False,False,ersonas fuimos con amigos y fuimos en familia con bebe de anos que se va a los brazos de diana sin pensarlo por que es un amor es | ecialmente siempre me pregunta que quiero comer o beber es muy responsable extremadamente amable y cuida mucho de su personal algo,itio recomendado al nos dejaron pasar con nuestro perro y sin reserva el risotto estaba excelente sin duda repetiremos,,,,,pisco sour es de los mejores que he probado y de postre recomiendo la torta de tres leches very good service from the staff the f | muy rico y una gran atencion de sus empleados la tarta de queso es deliciosa y los chipirones la paella muy rica,servida en porciones generosas muy buena relacion calidad precio en general y gracias a roger que nos cuido con cuidado y buen hum | super delicioso con precio razonable langostino en aceite de ajo chispeante es muy recomendable recu,,,,Los comensales destacan la excelente,"Los clientes destacan haber descubierto un lugar que supera las expectativas, ofreci","paella(16), risotto(6), pulpo(4), croquetas(4), tarta(4)","paella(16), risotto(6), pulpo(4), croquetas(4), tarta(4), tortilla(2), jamón(2), huevos rotos(2), hummus(1), chipirones(1), lomo(1), bacalao(1), berenjenas(1), salmón(1), sangria(1)",,"comida, alberto, excelente, atención, buena",
13,SteakBurger Arenal I Hamburguesas Madrid,"Calle del arenal, 26",90,4.8,4.511,91.1,2.2,6.7,6,22,65,17,2,1,5,65,60,24,14,12,5,4,7,19,1,0,0,10,72.2,66.7,26.7,15.6,13.3,5.6,4.4,7.8,21.1,1.1,0.0,0.0,11.1,61,56,24,11,9,5,4,6,17,1,0,0,9,4,3,0,1,2,0,0,0,2,0,0,0,1,4.58,4.55,4.75,4.21,4.0,4.8,5.0,4.43,4.37,4.0,,,4.1,True,True,True,True,True,False,False,False,True,False,False,False,True,False,False,False,False,False,False,False,False,True,False,True,,,,,,,,,visitado para mi pareja cena de cumpleanos mientras estaba de vacaciones una calida bienvenida con un excelente | reservamos este restaurante para mi cumpleanos mientras estabamos en madrid idealmente situado en el centro de madri,,muy buenas hamburguesas buena comida en general y sin gluten la hamburguesa q quieras que eso para mi es importante y en especial,Este establecimiento es altamente recomendado por la excelente,"La comida recibe elogios por su calidad y sabor, especialmente las","nachos(4), sangría(3), bonito(3), solomillo(2), filete(1)","nachos(4), sangría(3), bonito(3), solomillo(2), filete(1), guacamole(1)",,"comida, nicole, servicio, atención, hamburguesa",americana
14,Ástor,"Calle del almendro, 9",90,4.8,4.756,94.4,1.1,4.4,4,16,79,6,1,2,2,73,80,31,13,12,5,0,7,29,6,1,0,25,81.1,88.9,34.4,14.4,13.3,5.6,0.0,7.8,32.2,6.7,1.1,0.0,27.8,71,76,31,11,10,5,0,7,29,5,1,0,25,1,4,0,2,2,0,0,0,0,1,0,0,0,4.88,4.75,4.84,4.38,4.25,5.0,,5.0,4.93,4.0,4.0,,4.92,True,True,True,True,True,False,False,False,True,False,False,False,True,False,False,False,False,False,True,True,False,False,True,True,,,,,,ambiente intimo atencion por parte del personal inmejorable quizas a la hora de pedir los | perfeccion absoluta restaurante intimo con un gran servicio aunque nos topamos con el barman con una peticion de,ivo y deliciosa entrada no te olvides de tomar el postre antes de salir y disfrutar de un tiempo maravilloso mientras que en astor | curado en soja y el clasico risotto de hongos al postre no llegamos porque estabamos a tope brindamos con las chicas de sala y co,,,la hora nos atendieron genial queriamos opciones vegetarianas y pescado nos dieron alternativas con mucha paciencia y pedagogia l,muy muy agradable y una opcion estupenda para los sin gluten repetiremos | o de jerez me comentaron que tenian opcion de pan sin gluten cosa que se agradece mucho muy recomendable,Este establecimiento es altamente valorado por su ambiente acog,El personal destaca por su,"risotto(13), croqueta(7), filete(5), mejillones(4), pasta(4)","risotto(13), croqueta(7), filete(5), mejillones(4), pasta(4), ceviche frito(4), jamón(4), mollejas(4), empanada(3), ramen(3), curry(2), chorizo(2), salmón(2), bacalao(2), costillar(2)",,"comida, servicio, excelente, experiencia, atención",
15,Azotea Forus Barceló,"Calle de Barceló, 6",90,4.8,4.622,90.0,4.4,5.6,5,17,72,9,4,3,2,71,36,28,15,5,4,1,8,15,14,19,0,10,78.9,40.0,31.1,16.7,5.6,4.4,1.1,8.9,16.7,15.6,21.1,0.0,11.1,64,31,25,14,5,4,1,8,14,13,17,0,10,3,3,2,1,0,0,0,0,1,0,1,0,0,4.65,4.47,4.57,4.67,4.8,4.75,5.0,4.75,4.6,4.86,4.58,,4.8,True,True,True,True,False,False,False,False,True,True,True,False,True,False,False,True,True,False,False,True,True,True,True,False,,,gas a tomar el brunch y ha sido un descubrimiento terraza muy bonita camareros muy amables y la comida espectacular con plato sala | marera fue encantadora y el sitios super acogedor terraza preciosa con vistas muy bonitas,a y servicio increible el sitio es una azotea con vistas bonitas donde tomar una bebida es muy agradable las bebidas bien de preci | muy bien y el ambiente un diez ademas muy buenas vistas a todo madrid,,,la ensalada de remolacha buenisima y el humus los postres tambien estan muy ricos y las camareras majisimas laura tan atenta como | un arroz incomestible que tuve que devolver y un postre pasable,comida los cocteles todo espectacular la relacion calidad precio es muy buena para ser el centro de madrid y siempre salgo encanta | parte de laura nos trato genial y las copas a un precio justo para una azotea con buenas vistas,fui con un grupo de amigos a celebrar un cumpleanos la comida muy bien y el ambiente un diez ademas muy buenas vistas a t | fuimos un grupo grande de amigos a ultima hora esperando poder picar algo ya que no encont,nen platos asequibles para todo el mundo opciones vegetarianas y gran variedad especialmente destacable el servicio muy cordial y,,Los clientes destacan la excelente calidad del,"El ambiente es fenomenal, ideal para disfrutar de una buena experiencia.","nachos(3), bonito(3), migas(3), guacamole(2), pasta(2)","nachos(3), bonito(3), migas(3), guacamole(2), pasta(2), salmón(1), arroz(1), tarta(1), jamón(1)",,"laura, servicio, atención, lugar, buen",
16,Oven Mozzarella Preciados,"Calle Preciados, 11",93,4.8,4.548,89.2,1.1,9.7,9,8,77,6,1,2,7,74,73,18,12,7,3,2,4,25,2,1,0,13,79.6,78.5,19.4,12.9,7.5,3.2,2.2,4.3,26.9,2.2,1.1,0.0,14.0,69,67,17,8,5,3,2,4,23,1,1,0,11,4,5,1,4,2,0,0,0,2,1,0,0,2,4.69,4.64,4.72,3.75,4.14,5.0,5.0,5.0,4.6,3.0,5.0,,4.46,True,True,True,True,False,False,False,False,True,False,False,False,True,True,False,False,False,False,False,True,False,False,False,False,vinimos con nuestros ninos y les encanto la pasta casera la textura de los espaguetis estaba en su pu | super ameno y limpio lo recomiendo si vienen con ninos excelente atencion de maria,,,,,,asta trufada ufff delicioso todo y ahora viene el tiramisu | un sitio magnifico para cenar bien muy buenos postres y personal muy atento especialmente maria muy amable y atenta,,,,,Los clientes destacan la excelente calidad de,El personal es muy atento,"pasta(9), sangría(3), carbonara(3), bonito(3), tiramisú(2)","pasta(9), sangría(3), carbonara(3), bonito(3), tiramisú(2), tagliatelle(1), risotto(1), espaguetis(1), croquetas(1), salmón(1), focaccia(1)",,"comida, atención, servicio, maría, excelente",italiana
17,SteakBurger Fuencarral,"Calle Fuencarral, 73",90,4.7,4.767,95.6,2.2,2.2,2,13,76,10,2,1,1,67,54,9,6,11,0,0,6,19,0,0,0,2,74.4,60.0,10.0,6.7,12.2,0.0,0.0,6.7,21.1,0.0,0.0,0.0,2.2,64,53,9,4,10,0,0,6,18,0,0,0,2,2,0,0,1,1,0,0,0,1,0,0,0,0,4.79,4.85,4.89,3.83,4.64,,,5.0,4.74,,,,5.0,True,True,False,False,True,False,False,False,True,False,False,False,False,False,False,False,False,False,False,False,False,False,True,False,,,,,,,,,,o aprecie mucho el hecho de que tuvieran opciones vegetarianas para cada hamburguesa maria fue super amable y dulce,,La comida es consistentemente elogiada por su,"El servicio al cliente destaca por su atención y recomendaciones, creando una","nachos(6), costillar(4), helado(1), solomillo(1), croquetas(1)","nachos(6), costillar(4), helado(1), solomillo(1), croquetas(1), tarta(1), lomo(1)",,"comida, atención, hamburguesa, excelente, buena",americana
